{"capacity":{"executors":4},"manual_witness":{"tio-007":{"affected_tests":["test/todo-dashboard-registry.test.mjs","test/todo-gantt-independence.test.mjs","test/todo-gantt-layout.test.mjs","test/todo-gantt-render.test.mjs","test/todo-gantt-scope.test.mjs","test/todo-gantt-selfcontained.test.mjs","test/todo-independence-cli.test.mjs","test/todo-migration.test.mjs","test/todo-revision-set.test.mjs","test/todo-store.test.mjs"],"owns":[{"kind":"path","target":"src/todo-gantt-layout.mjs"}],"reads":[],"resources":[],"sensor_provenance":{"queries":[{"expect":{"kind":"affected","path":"src/todo-gantt-layout.mjs"},"query_id":"q-layout"}]},"state_effects":[],"unknowns":[],"writes":["src/todo-gantt-layout.mjs"]},"tio-008":{"affected_tests":["test/todo-dashboard-registry.test.mjs","test/todo-gantt-independence.test.mjs","test/todo-gantt-render.test.mjs","test/todo-gantt-selfcontained.test.mjs","test/todo-independence-cli.test.mjs","test/todo-revision-set.test.mjs"],"owns":[{"kind":"path","target":"src/todo-gantt-svg.mjs"},{"kind":"path","target":"src/todo-gantt-html.mjs"}],"reads":[],"resources":[],"sensor_provenance":{"queries":[{"expect":{"kind":"affected","path":"src/todo-gantt-svg.mjs"},"query_id":"q-svg"},{"expect":{"kind":"affected","path":"src/todo-gantt-html.mjs"},"query_id":"q-html"}]},"state_effects":[],"unknowns":[],"writes":["src/todo-gantt-html.mjs","src/todo-gantt-svg.mjs"]},"tio-009":{"affected_tests":["test/todo-dashboard-registry.test.mjs","test/todo-gantt-independence.test.mjs","test/todo-gantt-render.test.mjs","test/todo-gantt-selfcontained.test.mjs","test/todo-independence-cli.test.mjs","test/todo-revision-set.test.mjs"],"owns":[{"kind":"path","target":"src/todo-gantt-html.mjs"}],"reads":[],"resources":[],"sensor_provenance":{"queries":[{"expect":{"kind":"affected","path":"src/todo-gantt-html.mjs"},"query_id":"q-html"}]},"state_effects":[],"unknowns":[],"writes":["src/todo-gantt-html.mjs"]},"tio-010":{"affected_tests":["test/todo-dashboard-registry.test.mjs","test/todo-independence-cli.test.mjs","test/todo-revision-set.test.mjs"],"owns":[{"kind":"path","target":"src/todo-cli.mjs"}],"reads":[],"resources":[],"sensor_provenance":{"queries":[{"expect":{"kind":"affected","path":"src/todo-cli.mjs"},"query_id":"q-cli"}]},"state_effects":[],"unknowns":[],"writes":["src/todo-cli.mjs"]}},"plan_key":"todo-independence-ops","project_id":"lattice","schema":"lattice.todo_witness_set.v1","sensor_query_set":{"queries":[{"id":"q-status","operation":"status"},{"id":"q-layout","operation":"affected","target":"src/todo-gantt-layout.mjs"},{"id":"q-svg","operation":"affected","target":"src/todo-gantt-svg.mjs"},{"id":"q-html","operation":"affected","target":"src/todo-gantt-html.mjs"},{"id":"q-cli","operation":"affected","target":"src/todo-cli.mjs"}]},"witness_set_digest":"64e977b66ddce11a42531687f421ebf131ede50a6821e578f092a9e7c6ee70f5"}
