{"schema":"lattice.todo_witness_set.v1","project_id":"lattice","plan_key":"todo-independence-projection","capacity":{"executors":4},"sensor_query_set":{"queries":[{"id":"q-status","operation":"status"},{"id":"q-contracts","operation":"affected","target":"src/todo-independence-contracts.mjs"},{"id":"q-pipeline","operation":"affected","target":"src/todo-independence.mjs"}]},"manual_witness":{"tip-002":{"owns":[{"kind":"path","target":"src/todo-independence-contracts.mjs"}],"reads":[],"writes":["src/todo-independence-contracts.mjs"],"resources":[],"state_effects":[],"sensor_provenance":{"queries":[{"query_id":"q-contracts","expect":{"kind":"affected","path":"src/todo-independence-contracts.mjs"}}]},"affected_tests":[],"unknowns":[]},"tip-003":{"owns":[{"kind":"path","target":"src/todo-independence.mjs"}],"reads":[],"writes":["src/todo-independence.mjs"],"resources":[],"state_effects":[],"sensor_provenance":{"queries":[{"query_id":"q-pipeline","expect":{"kind":"affected","path":"src/todo-independence.mjs"}}]},"affected_tests":[],"unknowns":[]}},"witness_set_digest":"dc8dfecd8d77b4d665521d6bc617450e4701204bf1be5048d409f95a9f249480"}
